english	translation	category	sub_category	source
Big mysterious crate. You wonder what could be inside.		examine	object	Crate
Looks and smells like a place where goblins live.		examine	object	Cave Entrance
The door is closed.		examine	object	Door
A powerful ranging device, unfortunately not working.		examine	object	Broken multicannon
A powerful ranging device that fires metal balls.		examine	object	Dwarf multicannon
The cannon is built on here.		examine	object	Cannon base
The mounting for the multicannon.		examine	object	Cannon stand
The barrels of the multicannon.		examine	object	Cannon barrels
I can climb down this.		examine	object	Ladder
I can climb up this.		examine	object	Ladder
A pile of rocks is blocking my path.		examine	object	Rock pile
Mud caved in from above.		examine	object	Mud pile
Intended to keep the goblins away from the mines.		examine	object	Railing
A broken rail.		examine	object	Railing
Its eyes stare off into the distance...		examine	object	Mysterious statue
The door is shut.		examine	object	Door
Unusually lumpy looking.		examine	object	Sacks
Seems to be some kind of clock part.		examine	object	Clock spindle
Yup, definitely a lever.		examine	object	Lever
Stops people walking past.		examine	object	Gate
Animals have no table manners.		examine	object	Food trough
Looks like an outlet pipe to the lake.		examine	object	Wall Pipe
I can see fish swimming in the water.		examine	object	Fishing spot
It seems to sparkle.		examine	object	Water
I can see really big fish swimming in the water.		examine	object	Fishing spot
Big Dave is fishing here.		examine	object	Fishing spot
Joshua is fishing here.		examine	object	Fishing spot
A wooden gate.		examine	object	Gate
Hmmm... I wonder if it's loose enough to get through.		examine	object	Loose Railing
It's locked.		examine	object	Gate
It's a flight of stairs.		examine	object	Stairs
Known commonly as Red worm vine.		examine	object	Vine
A fancy hole in the wall.		examine	object	Door
A fancy hole in the ceiling.		examine	object	Ladder
A shrine to chaos.		examine	object	Chaos altar
Is there something in there?		examine	object	Giant crystal
Used for storage.		examine	object	Crate
Where bees live.		examine	object	Beehive
Handy for boarding boats.		examine	object	Gangplank
Sturdy looking door.		examine	object	Large door
Securely fastened shut.		examine	object	Large door
I wonder what's inside...		examine	object	Chest
Looks secure.		examine	object	Prison Gate
Seems very old...		examine	object	Lever bracket
I guess you pull it...		examine	object	Lever
A wrought iron gate.		examine	object	Gate
I don't like the look of this!		examine	object	Lever
A dark flight of stairs.		examine	object	Stairs
Don't you open that trapdoor!		examine	object	Trapdoor
I can climb this.		examine	object	Ladder
A sturdy door.		examine	object	Door
I wonder what's inside.		examine	object	Closed chest
Perhaps I should search it.		examine	object	Open chest
I wonder what that's there for...		examine	object	Trapdoor
An appliance for cooking with.		examine	object	Cooking range
A party balloon.		examine	object	Party Balloon
Aren't they pretty?		examine	object	Party Balloon
Paaaarty!		examine	object	Party Balloon
An escape route.		examine	object	Ladder
Looks spooky down there.		examine	object	Ladder
A large double door.		examine	object	Large door
Smelly.		examine	object	Compost heap
An ornate fountain.		examine	object	Fountain
It looks possible to scramble up the wall here, with skill.		examine	object	Rocks
Lots of books.		examine	object	Bookcase
This wall looks odd...		examine	object	Wall
I wonder what this does...		examine	object	Lever
I'm not touching that.		examine	object	Strange machine
A special furnace for destroying contaminated items.		examine	object	Incinerator
Fly Gnome Air.		examine	object	Gnome glider
Probably pilot error.		examine	object	Crashed glider
The Blurberry bar - cocktails extraordinaire!		examine	object	Blurberry bar
A large gate in the gnome style.		examine	object	Gate
The entrance to the cave.		examine	object	Hollowed rock
A quirky gnome lamp.		examine	object	Lamp
These insects love this light.		examine	object	Lamp
It's amazing what bees produce!		examine	object	Candles
Posh candlesticks.		examine	object	Candles
Scary lighting apparatus.		examine	object	Candles
An ornamental lighting fixture.		examine	object	Chandelier
A mysterious glowing ice crystal.		examine	object	Ice Light
Useful for making ships move.		examine	object	Sail
This figure brings luck to those who sail.		examine	object	Figurehead
Barnacle infested rope.		examine	object	Pile of rope
Allows access to other parts of the ship.		examine	object	Ship's ladder
Without this I'm going around in circles.		examine	object	Ship's wheel
Used for pulling things up.		examine	object	Winch
Useful if there is any wind.		examine	object	Sail
How much does this weigh?		examine	object	Anchor
I can climb up here.		examine	object	Ship's ladder
I can go below decks with this ladder.		examine	object	Ship's ladder
A conveniently rolled sail.		examine	object	Hoisted sail
I'm not allowed to climb this ladder.		examine	object	Ladder
It's like a land rudder.		examine	object	Plough
Disturbingly man-like.		examine	object	Scarecrow
I bet there's a needle in it somewhere.		examine	object	Hay bales
A home for baby creatures.		examine	object	Eggs
In the city we would call this mouldy rubbish.		examine	object	Compost
A used cart seller will probably try and sell it later.		examine	object	Broken cart
One horsepower; wooden suspension: a beauty.		examine	object	Cart
Dead tree parts piled neatly together.		examine	object	Log pile
A patch of soft, dark brown matter. Probably mud.		examine	object	Mud patch
A pile of something that I hope is mud.		examine	object	Mudpile
Potato-licious!		examine	object	Potato
Baby bread.		examine	object	Wheat
The remains of a bad driver.		examine	object	Broken cart wheel
The perfect place to store things.		examine	object	Cabinet
These open and close!		examine	object	Drawers
This may be worth searching.		examine	object	Drawers
A wooden crate for storage.		examine	object	Crate
An old crate for storage.		examine	object	Crate
A pile of boxes for storage.		examine	object	Boxes
A wooden barrel for storage.		examine	object	Barrel
A wooden barrel containing lots of fish.		examine	object	Barrel
It's got ale in it.		examine	object	Barrel
These may have something in them.		examine	object	Sacks
Useful for transportation of delicate items.		examine	object	Crate
This may be worth opening.		examine	object	Cupboard
The perfect accompaniment to a bedroom.		examine	object	Dresser
A stand for hats!		examine	object	Hat stand
A good source of books!		examine	object	Bookcase
A woven storage basket.		examine	object	Basket
A gigantic pottery urn.		examine	object	Large urn
This no doubt contains arcane knowledge.		examine	object	Bookshelves
I wonder what this spooky item contains.		examine	object	Wardrobe
It smells funny in there.		examine	object	Wardrobe
A fishing net full of fish.		examine	object	Full fishing net
Bamboo storage!		examine	object	Bookcase
I hope no-one's home...		examine	object	Coffin
A small simple gravestone.		examine	object	Small gravestone
A simple marker for a forgotten person.		examine	object	Grave marker
The remains of someone lie inside.		examine	object	Tombstone
A monument to a special person.		examine	object	Large grave stone
The inscription is worn away and unreadable.		examine	object	Gravestone
'Here lies...' is all I can read.		examine	object	Gravestone
Whoever bought this must have really cared for the inhabitant.		examine	object	Large grave
Looks like a stone doorway to me.		examine	object	Henge
Looks like a stone doorway to my untrained eye.		examine	object	Henge
Shrine to the glory of Saradomin.		examine	object	Altar
An ancient altar to the glory of Guthix.		examine	object	Altar of Guthix
Shrine to the glory of Zamorak.		examine	object	Chaos altar
Looks suspiciously like a big stone table.		examine	object	Dolmen
A really posh upright coffin.		examine	object	Coffin
Whoever's inside must have been rich.		examine	object	Coffin
With skill I can play this.		examine	object	Church organ
Great for sleeping in.		examine	object	Bed
A stylish-looking bed.		examine	object	Bed
A drab-looking bed.		examine	object	Bed
Technically a bed.		examine	object	Bed
I guess I could sleep in it if I were really tired.		examine	object	Bed
Lovely comfy-looking big bed.		examine	object	Bed
Posh-looking bed.		examine	object	Bed
A bed fit for a king.		examine	object	Bed
One of the nicest beds I have ever seen.		examine	object	Bed
Perfect for snoozing in the sun.		examine	object	Hammock
A comfortable seat to recline and recuperate.		examine	object	Chaise lounge
I don't think anyone's slept here for a long time.		examine	object	Bed
Bamboo's a versatile material.		examine	object	Bed
A door.		examine	object	Door
Bashed, broken and dumped.		examine	object	Door
A way out!		examine	object	Crevice
It's even smokier in there...		examine	object	Crevice
What could possibly fit through that?		examine	object	Crevice
It's covering a little alcove.		examine	object	Curtain
Allows for equal distribution of spice.		examine	object	Red spice (4)
Someone bent defence.		examine	object	Broken Fence
A large door.		examine	object	Door
Frozen water has formed an icicle here.		examine	object	Icicle
It looks cold in there.		examine	object	Cave entrance
This person was of great importance.		examine	object	Statue of a warrior
A monarch chiselled in stone.		examine	object	Statue of a king
A sculpture of a monarch.		examine	object	Statue of a king
A huge carving of an ancient race.		examine	object	Tribal statue
A depiction of a great dwarven miner.		examine	object	Dwarf statue
A depiction of a famous gnome warrior.		examine	object	Gnome statue
The head and shoulders of a famous gnome.		examine	object	Gnome statue
A depiction of a famous gnomeballer.		examine	object	Gnome statue
A carving of a figure from the history of Gielinor.		examine	object	Statue
An expertly chiselled statue.		examine	object	Statue
An unusual symbol of ancient times.		examine	object	Statue
An expertly crafted vase.		examine	object	Vase
An expertly chiselled statue of a bird.		examine	object	Statue
What a good likeness!		examine	object	Statue of Saradomin
A depiction of the evil god Zamorak.		examine	object	Statue of Zamorak
A base for the statue to sit on.		examine	object	Statue steps
The scrying glass of a seer.		examine	object	Crystal ball
Banking transactions are processed here.		examine	object	Bank table
Banking transactions are recorded here.		examine	object	Bank table
Contains washing items.		examine	object	Bathroom table
A nice sturdy looking table.		examine	object	Table
A banquet could be eaten from this.		examine	object	Table
Useful for putting things on.		examine	object	Table
At one time it was for putting things on.		examine	object	Table
The napkins are made from real silk.		examine	object	Table
Items for making clothes are kept on here.		examine	object	Table
The ideal place to study.		examine	object	Study desk
A handy workbench for a handy person.		examine	object	Workbench
Sit back and enjoy the view.		examine	object	Picnic bench
Items are for sale here.		examine	object	Counter
A creepy looking table.		examine	object	Table
There are some strange chemicals here.		examine	object	Chemistry Table
It's a banquet table.		examine	object	Table
Finely wrought wares of silver.		examine	object	Silver stall
Garments for the discerning.		examine	object	Silk stall
Bread cakes and pastries.		examine	object	Bakery stall
Finest precious stones.		examine	object	Gem stall
These will keep you warm.		examine	object	Fur stall
The spice is right.		examine	object	Spice stall
Always a source of good bargains.		examine	object	Market stall
Fine brews from exotic regions.		examine	object	Tea stall
Keeps mine carts from rolling away.		examine	object	Buffers
You can 'cart' things around in this.		examine	object	Mine cart
Makes you taller.		examine	object	Rack
A bit large for a bracelet!		examine	object	Stocks
A macabre variation on the neck tie.		examine	object	Gallows
Dead and half buried.		examine	object	Buried skeleton
Disturbing but tidy.		examine	object	Pile of skulls
I don't even want to think about what did that...		examine	object	Charred bones
Now that's what I call slimline!		examine	object	Corpse
He looks very relaxed.		examine	object	Corpse
Now he's just too thin.		examine	object	Corpse
He hasn't eaten in a long time.		examine	object	Corpse
No cats were harmed in the making of this device.		examine	object	Catapult
Shattered.		examine	object	Broken barrel
Useful for catching small fish.		examine	object	Small fishing net
A passage leading into the next chamber of the cave.		examine	object	Passage
Screams can be heard within.		examine	object	Cave
Careful out there!		examine	object	Cave exit
I was always forced to play this as a child.		examine	object	Piano
I never learnt to play.		examine	object	Piano
Time for a recital?		examine	object	Piano stool
Tick-tock, it's a clock.		examine	object	Grandfather Clock
The noxious liquid bubbles horribly.		examine	object	Swamp bubbles
Shows which way the wind blows.		examine	object	Weather vane
Looking good!		examine	object	Mirror
A privacy aid!		examine	object	Bath screen
Use this to get changed behind and retain modesty.		examine	object	Screen
I don't even want to think about what's cooking in that.		examine	object	Cauldron
Good for sweeping.		examine	object	Broom
I'm guessing it's for making women's clothes.		examine	object	Clothes model
Helps make human clothing.		examine	object	Clothes model
A hole.		examine	object	Hole
Dead animal head. Lovely.		examine	object	Animal skull
Must have been laid by a huge bird.		examine	object	Big egg
Whatever it was I'm glad it's not alive.		examine	object	Carcass
Spooky!		examine	object	Curved bone
A dog's idea of heaven.		examine	object	Large bone
Ding-Dong!		examine	object	Bell
Some kind of pulley system.		examine	object	Bell mechanism
Surprisingly rope-shaped.		examine	object	Bell rope
Suspiciously hole-shaped.		examine	object	Hole in wall
A huge chunk of shining natural crystal.		examine	object	Crystal cluster
A recently extinguished fire.		examine	object	Fire remains
A barrel full of swords...		examine	object	Barrel
It looks like there is something caught inside this trap.		examine	object	Shaking box
I'm glad this isn't around anymore!		examine	object	Buried skeleton
A crude torch stuck in the ground.		examine	object	Standing torch
A fissure in the cave wall.		examine	object	Cave web
This huge web blocks your path.		examine	object	Web
A huge web, cruelly slashed in half.		examine	object	Slashed web
Looks a little too broken to climb.		examine	object	Broken ladder
An old-looking ladder.		examine	object	Ladder
An old-looking bit of scaffolding.		examine	object	Scaffold
It's a door made from bamboo.		examine	object	Bamboo Door
A loom.		examine	object	Loom
You'd need a big siege engine to force that.		examine	object	City Gate
I always wonder if someone's hiding inside when I see these.		examine	object	Suit of armour
Looks kind of like a man made of metal.		examine	object	Suit of armour
Not suitable for children. Aim away from face.		examine	object	Cannon
Big heavy metal balls.		examine	object	Cannonballs
The easiest opponent I'll ever fight.		examine	object	Dummy
A wooden defensive structure.		examine	object	Wooden defence
For private use only!		examine	object	Target
Break glass in case of emergency.		examine	object	Sword cabinet
An attractively laid out collection of ranging weapons.		examine	object	Bow cabinet
A row of sharp pointy spears.		examine	object	Spear wall
Rows of sharp pointy spears.		examine	object	Spear wall
A tatty old standard.		examine	object	Standard
A standard.		examine	object	Standard
A blue standard.		examine	object	Standard
A standard of the gnome race.		examine	object	Standard
The standard of the ogre race.		examine	object	Standard
The flag of Asgarnia.		examine	object	Flagpole
The flag of Kandarin.		examine	object	Flagpole
The flag of Ardougne.		examine	object	Flagpole
A standard of Asgarnia.		examine	object	Standard
A standard of Kandarin.		examine	object	Standard
A standard of Misthalin.		examine	object	Standard
A standard of Varrock.		examine	object	Standard
A flag flies here.		examine	object	Flagpole
A sculpted trunk of wood.		examine	object	Totem Pole
Takes my dirty bath water away.		examine	object	Bath pipes
It smells horrible in there.		examine	object	Large sewer pipe
Ideal for washing things in.		examine	object	Sink
Wash here.		examine	object	Bath
No this is not a mirage!		examine	object	Well
Everyone needs a water feature.		examine	object	Fountain
A beautiful water feature.		examine	object	Fountain
There's a cover over this manhole.		examine	object	Manhole
How dangerous, someone has left this manhole open.		examine	object	Manhole
Best used with a bucket.		examine	object	Well
If only I had one of those at home...		examine	object	Bar pumps
A painting of the King looking royal.		examine	object	Portrait
A beautiful landscape.		examine	object	Painting
A mysterious figure stands alone in this haunting image.		examine	object	Painting
Hail to the King!		examine	object	Portrait
I don't know much about art, but I like this.		examine	object	Landscape
A painting of some guy standing around somewhere.		examine	object	Painting
A really bad portrait of the King.		examine	object	Painting
Fine brushwork adds to the realism of this serene landscape.		examine	object	Landscape
Pretty good painting.		examine	object	Painting
I can see the stars on this.		examine	object	Star chart
A picture of the stars with funny diagrams and things on.		examine	object	Star chart
Cross shaped.		examine	object	Cross
Mmmm decorative!		examine	object	Hanging banner
Brightens up the room a bit.		examine	object	Hanging banner
Not bad at all.		examine	object	Hanging banner
Alas poor unicorn, I knew him.		examine	object	Unicorn's head
Probably looked better mounted on the dragon's neck.		examine	object	Dragon's head
Not what I would pick as wall decoration.		examine	object	Dragon's head
Looks like the bull lost.		examine	object	Bull's head
Trinkets and stuff.		examine	object	Charms
A magical wall decoration.		examine	object	Magical symbol
Something is written on it. I can't read what.		examine	object	Plaque
Looks like an eye with huge lashes.		examine	object	Eye decoration
A tablet covered in weird looking little squiggles and pictures.		examine	object	Glyphs
A posh water bowl.		examine	object	Font
Disturbingly its eyes look everywhere in the room except at you.		examine	object	Spooky picture
What has a face and hands but is not a man?		examine	object	Clock face
It's a time machine....sort of!		examine	object	Clock face
'Ask about our low, low interest rates!'		examine	object	Bank notice board
Some helpful people have placed notes on here, how nice.		examine	object	Noticeboard
Essentials for a seamstress.		examine	object	Clothes equipment
It really was this big!		examine	object	Stuffed swordfish
He doesn't look too jolly to me!		examine	object	Jolly Roger
Looks like this ship was way off course!		examine	object	Hanging wheel
X marks the spot.		examine	object	Pirate map
Complete with authentic seaweed!		examine	object	Fishing net
This mentions the monk trapped here...		examine	object	Plaque
A useful ranging device.		examine	object	Bow and Arrow
Use these with bows.		examine	object	Arrows
A powerful throwing weapon.		examine	object	Javelin
Improved Leather armour for archers.		examine	object	Studded Leather
Leather made from the skin of a Dragon.		examine	object	Dragonhide Leather
I can climb over the fence with this.		examine	object	Stile
This section of railing has been broken		examine	object	Broken Railing
There is a hole in this section of the railing.		examine	object	Broken Railing
Someone was thirsty...		examine	object	Shelves
Full of lovely drinks!		examine	object	Shelves
Storage for cookery items.		examine	object	Cooking shelves
Storage for all needs.		examine	object	Shelves
What kind of sick person keeps a skull on their wall?		examine	object	Shelf
Esoteric artefacts.		examine	object	Shelf
I don't want to know what's in those little urns.		examine	object	Shelf
Used for storing things on.		examine	object	Shelves
Tailor made for needlework supplies		examine	object	Clothing shelves
Prepared hides hang here drying.		examine	object	Tanning line
This contains dye for leather.		examine	object	Vat
Used to squeeze moisture from the hide.		examine	object	Mangle
Danger!		examine	object	Danger sign
This tells you which way is which.		examine	object	Signpost
Ye olde Shrimp and Parrot.		examine	object	Sign
The Blue Moon Inn - Licensed to sell intoxicating liquor.		examine	object	Sign
The Jolly Boar - Purveyors of fine brews.		examine	object	Sign
The Rusty Anchor - Licensed to sell intoxicating beverages.		examine	object	Sign
The Shrimp and Parrot - Licensed to sell dangerous liquids.		examine	object	Sign
The Dead Man's Chest - Brews to maroon any pirate.		examine	object	Sign
The Rising Sun - Purveyors of fine liquor.		examine	object	Sign
The Forester's Arms - Quality Real Ales.		examine	object	Sign
The Flying Horse - Often seen after 10 pints.		examine	object	Sign
The Dancing Donkey - Licensed to sell intoxicating beverages.		examine	object	Sign
The Dragon Inn - Visit us for a fiery brew!		examine	object	Sign
Karamja Spirits bar - For all your alcohol needs.		examine	object	Sign
North to Varrock :: East to Al Kharid.		examine	object	Signpost
North road to Draynor Village :: East road to Varrock.		examine	object	Signpost
North to Draynor Village.		examine	object	Signpost
North to Draynor Manor :: West to Asgarnia.		examine	object	Signpost
South to the Wizards' Tower :: East to Lumbridge.		examine	object	Signpost
South to Lumbridge :: West to Varrock :: East to the Digsite.		examine	object	Signpost
South to Al Kharid :: West to Lumbridge :: East to the Digsite.		examine	object	Signpost
North to Varrock :: East to the Digsite.		examine	object	Signpost
South to the Wizards' Tower :: North to Draynor Village :: East to Lumbridge.		examine	object	Signpost
The ideal thing to sit on.		examine	object	Chair
Not so good for sitting on.		examine	object	Smashed chair
A comfortable seat.		examine	object	Chair
Good for sitting on.		examine	object	Chair
Good for rocking in!		examine	object	Rocking chair
A kingly seat for a royal behind.		examine	object	Throne
The perfect way to sit at the bar.		examine	object	Barstool
Gnomes sit on these.		examine	object	Stool
Gnomes are found sitting here.		examine	object	Bench
Sit back and relax...		examine	object	Bench
Used for sitting on.		examine	object	Chair
Do I dare sit on this?		examine	object	Chair
Church seating.		examine	object	Pew
Park it here...		examine	object	Stool
Wouldn't like to sit on that for too long...		examine	object	Ice Throne
Keeps the neighbours out!		examine	object	Hedge
Found in wild areas.		examine	object	Bush
These are commonly found.		examine	object	Bush
An unusual bush.		examine	object	Bush
A wild bush.		examine	object	Bush
All the leaves have fallen off.		examine	object	Bush
A commonly found bush.		examine	object	Bush
Bushy!		examine	object	Bush
A rose by any other name would still have prickly bits.		examine	object	Rosebush
The abode of a fairy.		examine	object	Fairy house
Fairies need money too!		examine	object	Fairy bank
A fairy is selling items here.		examine	object	Fairy market stall
A small potted plant.		examine	object	Potted fern
Someone has planted this.		examine	object	Potted fern
A nicely potted fern.		examine	object	Potted fern
Better than weeding.		examine	object	Potted fern
I bet bees like this.		examine	object	Potted flower
A large potted plant.		examine	object	Potted plant
A plant in a bamboo pot.		examine	object	Potted plant
Cabbage... yuck!		examine	object	Cabbage
Found near the water's edge.		examine	object	Bullrushes
Not good for eating.		examine	object	Mushroom
Fungal growth.		examine	object	Mushroom
Poisonous no doubt.		examine	object	Mushrooms
I doubt that's edible.		examine	object	Fungus
A commonly found fern.		examine	object	Small fern
Spiky!		examine	object	Thistle
A home for frogs.		examine	object	Waterlily
Otherwise known as a lilypad.		examine	object	Waterlily
Smells lovely!		examine	object	Heather
Who is this Heather girl?		examine	object	Heather
I wonder why it's purple?		examine	object	Heather
I'd better not get stung.		examine	object	Nettles
The tendrils of a creeping plant.		examine	object	Creeping plant
Nicely planted.		examine	object	Rockery
A large curling plant.		examine	object	Curling plant
That's pretty.		examine	object	Flower
Blooming!		examine	object	Flower
Commonly found in grassy areas.		examine	object	Daisies
Is this the biggest flower around?		examine	object	Sunflower
These are huge!		examine	object	Sunflowers
A rare flower.		examine	object	Flowers
Don't flowers make you feel better?		examine	object	Flowers
Can this talk?		examine	object	Tulips
You don't see that many of these.		examine	object	Flowers
I wonder what these are?		examine	object	Flowers
A rarely found flower.		examine	object	Flower
Very rare flowers.		examine	object	Flowers
These smell nice.		examine	object	Flowerbed
A bed of red flowers.		examine	object	Flowerbed
These are pretty.		examine	object	Flowerbed
Found only in jungle areas.		examine	object	Jungle flower
A very rare exotic flower.		examine	object	Orchid
A small fernlike plant.		examine	object	Jungle plant
The leaves of a nasty creeping plant.		examine	object	Vine
The flower of a nasty creeping plant.		examine	object	Vine
Nasty curling tendrils of a creeping plant.		examine	object	Vine
One of the most common trees in Gielinor.		examine	object	Tree
A healthy young tree.		examine	object	Tree
A commonly found tree.		examine	object	Tree
This tree has long been dead.		examine	object	Dead tree
An old weather beaten tree.		examine	object	Dead tree
It's only useful for firewood now.		examine	object	Dead tree
