english	translation	category	sub_category	source
Pointy!		examine	object	Spikes
Hop, hop, hoppity hop, and then you fall in molten lava.		examine	object	Stepping stone
I can climb up these rocks to another cave.		examine	object	Pile of rubble
I can climb down these rocks to another cave.		examine	object	Pile of rubble
Use this to swing across gaps.		examine	object	Ropeswing
I can swing on this tree.		examine	object	Ropeswing
The kalphite queen's old legs.		examine	object	Kalphite queen legs
Looks like I could squeeze through here.		examine	object	Tunnel
They might eventually reach the ceiling.		examine	object	Stalagmites
A perfectly appointed rosebush.		examine	object	Roses
Wild cadava berries are growing here.		examine	object	Cadava bush
Wild cadava berries grow here.		examine	object	Cadava bush
Wild redberries are growing here.		examine	object	Redberry bush
Wild redberries grow here.		examine	object	Redberry bush
Many newspapers.		examine	object	Stand
A wheelbarrow filled with the latest news.		examine	object	Newspapers
The Shield of Arrav.		examine	object	Display case
A plaque with some engraved lettering.		examine	object	Plaque
A branch protrudes here.		examine	object	Branch
This tree has an unusually long branch on it.		examine	object	Long branched tree
A nearly rotten wooden log that crosses the river.		examine	object	A wooden log
A rocky outcrop from the running water.		examine	object	Stepping stones
Are you sure you want to touch that? It seems to be alive and looking at you.		examine	object	Oozing barrier
He should have run a virus checker more often.		examine	object	Skeleton
They seem to have mould growing from them... ick!		examine	object	Skeleton
I'm sure he died of natural causes.  Like the plague...		examine	object	Skeleton
A teleport to the Telekinetic Theatre.		examine	object	Telekinetic Teleport
A teleport to the Enchanting Chamber.		examine	object	Enchanters Teleport
A teleport to the Alchemists' Playground.		examine	object	Alchemists Teleport
A teleport to the Creature Graveyard.		examine	object	Graveyard Teleport
A teleport to the Entrance hall.		examine	object	Exit Teleport
A clay pot containing the local grain.		examine	object	Food Barrel
Some simple cubes.		examine	object	Cube Pile
A pile of cylindrical shapes.		examine	object	Cylinder Pile
A pile of Icosahedrons.		examine	object	Icosahedron Pile
A pile of pentamids.		examine	object	Pentamid Pile
A hole the perfect shape for spheres		examine	object	Hole
A terrible stench arises from these tendrils, better keep your distance.		examine	object	Stinking tendrils
Goo drips from these wiggling horrors.		examine	object	Dripping tendrils
Not what you'd call inviting!		examine	object	Tendrils
You'll be lucky to keep a grip on this! Climb to go back to the start of this level.		examine	object	Goo covered vine
You'll be lucky to keep a grip on this, if you'd even want to!		examine	object	Goo covered vine
Goo oozes from this vine.		examine	object	Dripping vine
Danger - Extremely deadly creatures below!		examine	object	Danger Sign
A shiny box of medicine treasure away from the stinking ooze.		examine	object	Box of Health
Elaborate portal crafted from bones of the long dead.		examine	object	Portal of Death
Life in the midst of death.		examine	object	Cradle of Life
A chain of bones leading up.		examine	object	Bone Chain
A chain of bones leading down.		examine	object	Bone Chain
Bones of the dead lashed together.		examine	object	Boney ladder
If you've completed this level before, you may use this portal.		examine	object	Portal
I don't think she read the security tips.		examine	object	Skeleton
One less adventurer...		examine	object	Skeleton
I don't think he expected that.		examine	object	Skeleton
This vat is empty.		examine	object	Fermenting Vat
This vat is filled with water.		examine	object	Fermenting Vat
This vat is filled with bad ale.		examine	object	Fermenting Vat
This vat is filled with bad cider.		examine	object	Fermenting Vat
This vat contains a mixture of water and barley malt.		examine	object	Fermenting Vat
This vat contains a mixture of water, barley malt, and Hammerstone hops.		examine	object	Fermenting Vat
Dwarven Stout is fermenting in this vat.		examine	object	Fermenting Vat
This vat is filled with Dwarven Stout.		examine	object	Fermenting Vat
King Roald of Misthalin.		examine	object	Statue of a king
Queen Ellamaria of Misthalin.		examine	object	Statue of a queen
A depiction of King Healthorg the Great.		examine	object	Statue of a king
It throws stuff.		examine	object	Catapult
Brings armour to life.		examine	object	Magical Animator
It's a Dummy.		examine	object	Dummy
It's a hole.		examine	object	Hole
South to Falador :: West to Taverley :: East to Varrock.		examine	object	Stone signpost
Keeps unwelcome folk out of Falador.		examine	object	City gate
A rack for displaying fine maces.		examine	object	Rack
Shelves for maces.		examine	object	Shelves
A barrel of maces.		examine	object	Barrel
A table bearing a fine selection of maces.		examine	object	Table
Fine gems for sale!		examine	object	Shop counter
Precious stones for sale.		examine	object	Cabinet
Rising Sun Tavern.		examine	object	Sign
Rising Sun Tavern, Falador.		examine	object	Banner
Powers the spinning pole outside.		examine	object	Treadmill
The traditional sign of a barber.		examine	object	Spinning pole
A statue of a famous White Knight.		examine	object	Statue
I thought he'd be bigger than that.		examine	object	Statue of Saradomin
Big beard, robes. Yeah, that's Saradomin.		examine	object	Statue of Saradomin
A grand door.		examine	object	Castle door
A basic bed.		examine	object	Bed
Nice banquet table.		examine	object	Table
A sturdy-looking round table.		examine	object	Table
Armour of a White Knight. Decorative, but still effective.		examine	object	Suit of Armour
'Concerned about theft? Set a Bank PIN today!'		examine	object	Notice board
'Customers are reminded NEVER to tell ANYONE their password.'		examine	object	Notice board
This chest contains an impressive amount of Gold!!		examine	object	Chest
Hope springs eternal.		examine	object	Fountain
Where drunkards may be found.		examine	object	Bar
I'd really hate to drink anything that had been in here.		examine	object	Barrel
Smells alcoholic.		examine	object	Barrel
Dusty old books.		examine	object	Bookcase
What ancient rites were performed here?		examine	object	Standing stone
Weathered rocks.		examine	object	Rocks
Ready for a quick snip?		examine	object	Chair
Put your head in my hands...		examine	object	Chair
Ooh - pretty!		examine	object	Mirror
Makes your hair stay curly.		examine	object	Heater
Might be handy for a workman.		examine	object	Work bench
I can climb up and down these stairs.		examine	object	Staircase
It doesn't look like the way out.		examine	object	Locked door
A barstool.		examine	object	Barstool
A map of the Museum.		examine	object	Map
Stairs leading to the upper levels.		examine	object	Stairs
Stairs leading to the lower levels.		examine	object	Stairs
An information booth.		examine	object	Information booth
A barge under construction.		examine	object	Canal barge
Wall of the canal.		examine	object	Canal wall
Buckets of tar.		examine	object	Tar buckets
Planks of wood.		examine	object	Short planks
Filled with all sorts of old stuff.		examine	object	Storage crate
Some tools to work with.		examine	object	Tools
A beautifully-worked golden gate.		examine	object	Gate
A Saradomin symbol from the 4th Age.		examine	object	Display case
An ancient Saradomin symbol from the 4th Age.		examine	object	Display case
An old vase with Saradominist markings.		examine	object	Display case
Pottery from the 3rd or 4th Ages.		examine	object	Display case
Ancient gold jewelry.		examine	object	Display case
Rusty arrowheads, dating back to the early 4th Age.		examine	object	Display case
A Zarosian talisman found at the Dig Site.		examine	object	Display case
Stone tablet found at the Dig Site.		examine	object	Display case
An ancient coin from Senntisten.		examine	object	Display case
An old coin, accurately dating the city of Saranthium.		examine	object	Display case
An empty display case.		examine	object	Display case
A table for cleaning specimens.		examine	object	Specimen table
Contains Dig Site finds.		examine	object	Dig Site specimen rocks
Gap where a gate goes.		examine	object	Gap
An opening in the wall, with flappy bits called doors.		examine	object	Doorway
A thick wooden door.		examine	object	Door
It's a snake!		examine	object	Snake
A machine that powers the display.		examine	object	Machine
Push me.		examine	object	Button
Plaque.		examine	object	Plaque
A painting of King Lathas.		examine	object	Painting
A display of the different layers of soil.		examine	object	Display case
An early map of Gielinor.		examine	object	Display case
The staff of Armadyl.		examine	object	Display case
A display of three god symbols.		examine	object	Display case
A terracotta statue.		examine	object	Display case
Ancient archaeological finds.		examine	object	Display case
A display model of the druid stone circle.		examine	object	Display case
A display of different runes.		examine	object	Display case
A display model of the runestone essence rocks.		examine	object	Display case
A map of the world.		examine	object	Display case
A display of Robert the Strong in battle with Dragonkin.		examine	object	Display case
A star chart.		examine	object	Display case
A display of seven knights' helms.		examine	object	Display case
A map of Morytania.		examine	object	Display case
A model of a bridge over the River Lum.		examine	object	Display case
A model of the Observatory near Ardougne.		examine	object	Display case
Fangs for the memory.		examine	object	Display case
A map of the Barbarian Village.		examine	object	Display case
A map of Edgeville.		examine	object	Display case
Black Knight armour.		examine	object	Display case
Infinity equipment.		examine	object	Display case
Silverlight, the demon slayer.		examine	object	Display case
A display of weapons used by barbarians.		examine	object	Display case
Some weapons and runes.		examine	object	Display case
A display of Zamorakian symbols.		examine	object	Display case
Excalibur, de-stoned.		examine	object	Display case
Broken arrows.		examine	object	Display case
The Phoenix crossbow and Blackarm bands.		examine	object	Display case
A human skeleton - un-undead.		examine	object	Display case
Armour worn by White Knights.		examine	object	Display case
A mage arena guardian.		examine	object	Display case
A Gnome glider model.		examine	object	Display case
A map of Ardougne.		examine	object	Display case
A display of an ancient tome.		examine	object	Display case
An ordinary looking table.		examine	object	Table
A box.		examine	object	Box
A stack of boxes.		examine	object	Stacked Boxes
Some boxes.		examine	object	Boxes
These bones have been picked clean... Something around here is hungry!		examine	object	Skeleton
This leads to the Witch's House.		examine	object	Ladder
A piano with some sort of compartment.		examine	object	Piano
It's a rickety old drain pipe.		examine	object	Drain Pipe
A musical device.		examine	object	Gramophone
A musical box?		examine	object	Gramophone
A stand with a music sheet on it.		examine	object	Music Stand
A music stand.		examine	object	Music Stand
A glowing mound of earth.		examine	object	Earth Mound
A dry earth mound with beans in.		examine	object	Bean Mound
It's huge.		examine	object	Beanstalk
The stump from a large beanstalk.		examine	object	Beanstump
Maybe I can climb this.		examine	object	Crumbling wall
A secure looking door.		examine	object	Door
The dwarf's beard.		examine	object	Beard
A dwarf. He seems to be in his underwear!		examine	object	Rupert
A window in a tower. How fortuitous!		examine	object	Window
Rupert's Beard		examine	object	Beard
The princess's pendant.		examine	object	Pendant
I could climb up these.		examine	object	Nails
I could climb down these.		examine	object	Nails
This leads back to the witch's house.		examine	object	Mouse hole
The lock for the door.		examine	object	Lock
Some blunt looking nails.		examine	object	Nails
A witch's charm.		examine	object	Witch's charm
The mouse hole is in there.		examine	object	Drain
The top of the beanstalk.		examine	object	Beanstalk
An evil looking griffin.		examine	object	Grimgnash
A pile of Grimgnash's feathers.		examine	object	Feathers
Wonder where this leads to.		examine	object	Manhole
Glowing magic aura.		examine	object	Floor
It's got holes in it.		examine	object	Cheese
Lovely money!		examine	object	Coins
Bones are for burying!		examine	object	Bones
A strange symbol.		examine	object	Witch Glyph
An empty cage.		examine	object	Cage
This scroll has information about the dummy game.		examine	object	Information Scroll
This scroll has information about the catapult game.		examine	object	Information Scroll
This vat is filled with mature Dwarven Stout.		examine	object	Fermenting Vat
This vat contains a mixture of water, barley malt, and Asgarnian hops.		examine	object	Fermenting Vat
Asgarnian Ale is fermenting in this vat.		examine	object	Fermenting Vat
This vat is filled with Asgarnian Ale.		examine	object	Fermenting Vat
This vat is filled with mature Asgarnian Ale.		examine	object	Fermenting Vat
This vat contains a mixture of water, barley malt, and Harralander.		examine	object	Fermenting Vat
Greenmans Ale is fermenting in this vat.		examine	object	Fermenting Vat
This vat is filled with Greenmans Ale.		examine	object	Fermenting Vat
This vat is filled with mature Greenmans Ale.		examine	object	Fermenting Vat
This vat contains a mixture of water, barley malt, and Yanillian hops.		examine	object	Fermenting Vat
Wizards Mind Bomb is fermenting in this vat.		examine	object	Fermenting Vat
This vat is filled with Wizards Mind Bomb.		examine	object	Fermenting Vat
This vat is filled with mature Wizards Mind Bomb.		examine	object	Fermenting Vat
This vat contains a mixture of water, barley malt, and Krandorian hops.		examine	object	Fermenting Vat
Dragon Bitter is fermenting in this vat.		examine	object	Fermenting Vat
This vat is filled with Dragon Bitter.		examine	object	Fermenting Vat
This vat is filled with mature Dragon Bitter.		examine	object	Fermenting Vat
This vat contains a mixture of water, barley malt, and Bittercap mushrooms.		examine	object	Fermenting Vat
Moonlight Mead is fermenting in this vat.		examine	object	Fermenting Vat
This vat is filled with Moonlight Mead.		examine	object	Fermenting Vat
This vat is filled with mature Moonlight Mead.		examine	object	Fermenting Vat
This vat contains a mixture of water, barley malt, and oak roots.		examine	object	Fermenting Vat
Axeman's Folly is fermenting in this vat.		examine	object	Fermenting Vat
This vat is filled with Axeman's Folly.		examine	object	Fermenting Vat
This vat is filled with mature Axeman's Folly.		examine	object	Fermenting Vat
This vat contains a mixture of water, barley malt, and chocolate dust.		examine	object	Fermenting Vat
Chef's Delight is fermenting in this vat.		examine	object	Fermenting Vat
This vat is filled with Chef's Delight.		examine	object	Fermenting Vat
This vat is filled with mature Chef's Delight.		examine	object	Fermenting Vat
This vat contains a mixture of water, barley malt, and Wildblood hops.		examine	object	Fermenting Vat
Slayer's Respite is fermenting in this vat.		examine	object	Fermenting Vat
This vat is filled with Slayer's Respite.		examine	object	Fermenting Vat
This vat is filled with mature Slayer's Respite.		examine	object	Fermenting Vat
This vat contains some apple mush.		examine	object	Fermenting Vat
Cider is fermenting in this vat.		examine	object	Fermenting Vat
This vat is filled with cider.		examine	object	Fermenting Vat
This vat is filled with mature cider.		examine	object	Fermenting Vat
The entrance to the Cooking Guild.		examine	object	Door
A spicy meat kebab is cooking here.		examine	object	Kebab
A tear in the dimensional weave of the Abyss.		examine	object	Fire rift
Mysteriously flattened wheat.		examine	object	Crop circle
Suspiciously flattened wheat.		examine	object	Crop circle
The mysterious centre of a crop circle.		examine	object	Centre of crop circle
Something unusual is happening to the wheat.		examine	object	Magic wheat
Use this to leave Puro-Puro.		examine	object	Portal
100% wholegrain.		examine	object	Magical wheat
Kids grow up fast these days.		examine	object	Growing wheat
Life is short and then we die.		examine	object	Wilting wheat
The way into the maze.		examine	object	Magical wheat
You have patched the hole in the ship's hull.		examine	object	Hull
What could Melzar be keeping in this spooky wardrobe?		examine	object	Wardrobe
This, no doubt, contains arcane knowledge.		examine	object	Bookshelves
An old spooky table.		examine	object	Table
A tooth-shaped rock formation, protruding from the floor.		examine	object	Stalagmite
They look a bit brittle.		examine	object	Stalagmites
Looks like he's been dead a while now.		examine	object	Skeleton
I don't think he'd mind us checking for his wallet now.		examine	object	Skeleton
I'm sure he died of natural causes. Like a massive dragon or something.		examine	object	Skeleton
All that remains of the original adventurer that woke Elvarg.		examine	object	Skeleton
Looks like the shield took a lot of damage.		examine	object	Shield
There is something in this door for me to put objects in.		examine	object	Magic door
A burning candle on an interesting stand.		examine	object	Candle stand
Some weird vines.		examine	object	Vines
Some sort of plant.		examine	object	Plant
Remains of a wall.		examine	object	Wall
A tall pillar.		examine	object	Pillar
A mysterious hole at the top of the volcano.		examine	object	Hole
Burn me!		examine	object	Fire
Arrggh!		examine	object	Jenkins
I think I could climb over this.		examine	object	Wall
This tree is as white as ash.		examine	object	White tree
This tree was the victim of an enraged dragon.		examine	object	Tree
A fern.		examine	object	Fern
A dry plant.		examine	object	Fern
How does the plant photosynthesise?		examine	object	Fern
The plant is flowering.		examine	object	Flowering fern
This tree is dead.		examine	object	Dead calquat
This tree is not healthy.		examine	object	Diseased calquat
A burnt tree. What could have done this?		examine	object	A burnt tree
A tree found in tropical areas. This one is scorched.		examine	object	A tropical tree
Some weeds.		examine	object	Weeds
Maybe this statue is a warning.		examine	object	Dragon statue
A mystical stone circle.		examine	object	Circle
A warning beacon.		examine	object	Beacon.
These flames will never go out.		examine	object	Flames
The body of a mighty dragon.		examine	object	Dragon corpse
The headless body of a mighty dragon.		examine	object	Dragon corpse
This tent looks like it has been here for some time.		examine	object	A shabby tent
It's very windy!		examine	object	A flag
The trapdoor can only be opened from below.		examine	object	Trapdoor
A log jammed by the current, perhaps rideable.		examine	object	Aged log
A barbarian funeral pyre.		examine	object	funeral pyre
A barbarian bed.		examine	object	Barbarian bed
A barbarian table.		examine	object	Barbarian table
A barbarian chair.		examine	object	Barbarian chair
Crazy-looking whirlpool.		examine	object	Whirlpool
The thundering water exerts a tangible suction upon you.		examine	object	Mighty torrent
A patch of ash-strewn ground.		examine	object	Pyre site
The ground looks burned here.		examine	object	Boat station
A carved log.		examine	object	Carved log
Fit for a barbarian burial.		examine	object	Pyre boat
Some steps, for stepping up.		examine	object	Stairs
Some steps, for stepping down.		examine	object	Stairs
Small steps upwards.		examine	object	Stairs
Small steps downwards.		examine	object	Stairs
An old, sealed mithril door.		examine	object	Mithril door
A barbarian's anvil.		examine	object	Barbarian anvil
A pile of old barbarian bones.		examine	object	Skeleton
An area to hold one of Glough's smaller twisted creations.		examine	object	Holding area
A campfire. You can cook things on this.		examine	object	Campfire
A tunnel through the Abyss.		examine	object	Passage
This seems to be blocking the exit...		examine	object	Blockage
Tells you where places are.		examine	object	Signpost
An impressive display of the planets.		examine	object	Orrery
A bookcase with various books.		examine	object	Bookcase
A bookcase somewhat lacking in reading material.		examine	object	Bookcase
A cluttered work area.		examine	object	Professor's table
A great, big, sunny flower.		examine	object	Sunflower
Great, big, sunny flowers.		examine	object	Sunflowers
I could probably break this up with a pickaxe.		examine	object	Rock
I could probably break this up with a pickaxe. Oh wait, I just did.		examine	object	Rock
Pickaxe power!		examine	object	Broken rock
They don't look that solid, an axe could help me chop them down.		examine	object	Tendrils
I cannot tell a lie. I chopped them down.		examine	object	Chopped tendrils
If I'm agile enough I might be able to squeeze through...		examine	object	Gap
Remember to look up at the stars and not down at your feet.		examine	object	Telescope
A crude, stone goblin stove.		examine	object	Goblin stove
Where is the spider hiding?		examine	object	Spiderwebs
Potentially hot!		examine	object	Potential fire
A goblin fire. Looks fierce.		examine	object	Fire
Probably no longer used.		examine	object	Door
Shows one of the different constellations.		examine	object	Star chart
A stone archway.		examine	object	Stone arch
I could probably burn this away with a tinderbox.		examine	object	Boil
An attractively laid-out collection of ranging weapons.		examine	object	Bow cabinet
A good source of books.		examine	object	Bookcase
A creepy-looking table.		examine	object	Table
Only people of a lower combat level can use this lander.		examine	object	Novice Flag
Only people of a high combat level can use this lander.		examine	object	Intermediate Flag
Only ultimate fighters can use this lander.		examine	object	Veteran Flag
A nicely-fitted door.		examine	object	Door
Useful Ranged equipment.		examine	object	Bow and arrow
One of the Knights of the Round Table.		examine	object	Sir Lucan
Shelves filled with Carol's interesting books.		examine	object	Bookcase
Elizabeth's chest.		examine	object	Chest
These may be worth searching.		examine	object	Drawers
Looks like this is where the cook stores flour.		examine	object	Barrel of flour
An interesting choice of wall decoration.		examine	object	Dragon's head
These open and close.		examine	object	Drawers
Empty...so sad...		examine	object	Workbench
Good for rocking in.		examine	object	Rocking chair
With skill, I can play this.		examine	object	Church organ
Looking good.		examine	object	Mirror
A metal door.		examine	object	Metal door
For letting air in.		examine	object	Vent
A good place to eat.		examine	object	Table
Full of lovely drinks.		examine	object	Shelves
He has been turned to stone.		examine	object	King Arthur
Twelve bored men and women.		examine	object	The jury
He is fast asleep.		examine	object	Alan
Don't fancy your chances.		examine	object	Court judge
The gate is locked.		examine	object	Locked gate
Stairs leading to the courtroom.		examine	object	Stairs
The gate to exit the courtroom.		examine	object	Gate
A citizen of Seers' Village.		examine	object	Citizen
A citizen of the Seers village.		examine	object	Citizen
A statue of a Knight of Camelot.		examine	object	Statue
It looks like a spiders' nest to me.		examine	object	Spiders' nest
Looks like the killer smashed this to leave the mansion.		examine	object	Smashed window
A broken window.		examine	object	Smashed window
Looks like the window has been repaired.		examine	object	Window
Don't want to close this, I might not be able to get back down.		examine	object	Trapdoor
A pile of smelly rotting waste.		examine	object	Sinclair family compost heap
A sturdy home for bees.		examine	object	Sinclair family beehive
A strip of fly paper.		examine	object	Fly paper
A table for playing cards on.		examine	object	Table
I could probably burn this with fire.		examine	object	Boil
Burnt open.		examine	object	Boil
I could probably distract these with thievery.		examine	object	Eyes
An unstable portal across the dimensions...		examine	object	Abyssal Rift
Some abyssal tendrils.		examine	object	Tendrils
Pull me.		examine	object	Lever
Happy Birthday!		examine	object	Birthday cake
Drew's good old Sandstorm, good thing there's not a lot of steps needed to work this thing.		examine	object	Grinder
Suitable for celebrations.		examine	object	Table
Perfect for storing a large quantity of seeds.		examine	object	Seed vault
It's old and pretty broken.		examine	object	Broken rope bridge
A well used tree.		examine	object	Tree
Information is displayed here.		examine	object	Sign
Damages nearby monsters.		examine	object	Zapper
An ancient sentient tree.		examine	object	Spirit tree
A young sentient tree.		examine	object	Spirit tree
Gives you more special attack power.		examine	object	Power surge
Deals extra damage whenever you hit.		examine	object	Recurrent damage
Clears the floor.		examine	object	Ultimate force
A rough plinth.		examine	object	Plinth
A special vial.		examine	object	Empty vial
Drink the potion when you're ready to begin your dream.		examine	object	Potion
Drink from this vial to observe someone else's dream.		examine	object	Spectator potion
You must put money in here to pay for your dreams.		examine	object	Dominic's coffer
Exchange your reward points here.		examine	object	Rewards chest
Drink this when you're ready to wake up.		examine	object	Potion
A barrel for storing super ranging potion.		examine	object	Super ranging potion
A barrel for storing super magic potion.		examine	object	Super magic potion
A barrel for storing overload potion.		examine	object	Overload potion
A barrel for storing absorption potion.		examine	object	Absorption potion
You might want this for Elvarg.		examine	object	Anti-dragon shield
You might want these for a Tanglefoot.		examine	object	Magic secateurs
Used for low level missile spells.		examine	object	Chaos rune
