english	translation	category	sub_category	source
This compost bin contains supercompost (23/30).		examine	object	Big Compost Bin
This compost bin contains supercompost (24/30).		examine	object	Big Compost Bin
This compost bin contains supercompost (25/30).		examine	object	Big Compost Bin
This compost bin contains supercompost (26/30).		examine	object	Big Compost Bin
This compost bin contains supercompost (27/30).		examine	object	Big Compost Bin
This compost bin contains supercompost (28/30).		examine	object	Big Compost Bin
This compost bin contains supercompost (29/30).		examine	object	Big Compost Bin
This compost bin contains sixteen tomatoes.		examine	object	Big Compost Bin
This compost bin contains seventeen tomatoes.		examine	object	Big Compost Bin
This compost bin contains eighteen tomatoes.		examine	object	Big Compost Bin
This compost bin contains nineteen tomatoes.		examine	object	Big Compost Bin
This compost bin contains twenty tomatoes.		examine	object	Big Compost Bin
This compost bin contains twenty-one tomatoes.		examine	object	Big Compost Bin
This compost bin contains twenty-two tomatoes.		examine	object	Big Compost Bin
This compost bin contains twenty-three tomatoes.		examine	object	Big Compost Bin
This compost bin contains twenty-four tomatoes.		examine	object	Big Compost Bin
This compost bin contains twenty-five tomatoes.		examine	object	Big Compost Bin
This compost bin contains twenty-six tomatoes.		examine	object	Big Compost Bin
This compost bin contains twenty-seven tomatoes.		examine	object	Big Compost Bin
This compost bin contains twenty-eight tomatoes.		examine	object	Big Compost Bin
This compost bin contains twenty-nine tomatoes.		examine	object	Big Compost Bin
This compost bin contains thirty tomatoes.		examine	object	Big Compost Bin
This compost bin contains sixteen rotten tomatoes.		examine	object	Big Compost Bin
This compost bin contains seventeen rotten tomatoes.		examine	object	Big Compost Bin
This compost bin contains eighteen rotten tomatoes.		examine	object	Big Compost Bin
This compost bin contains nineteen rotten tomatoes.		examine	object	Big Compost Bin
This compost bin contains twenty rotten tomatoes.		examine	object	Big Compost Bin
This compost bin contains twenty-one rotten tomatoes.		examine	object	Big Compost Bin
This compost bin contains twenty-two rotten tomatoes.		examine	object	Big Compost Bin
This compost bin contains twenty-three rotten tomatoes.		examine	object	Big Compost Bin
This compost bin contains twenty-four rotten tomatoes.		examine	object	Big Compost Bin
This compost bin contains twenty-five rotten tomatoes.		examine	object	Big Compost Bin
This compost bin contains twenty-six rotten tomatoes.		examine	object	Big Compost Bin
This compost bin contains twenty-seven rotten tomatoes.		examine	object	Big Compost Bin
This compost bin contains twenty-eight rotten tomatoes.		examine	object	Big Compost Bin
This compost bin contains twenty-nine rotten tomatoes.		examine	object	Big Compost Bin
This compost bin contains thirty rotten tomatoes.		examine	object	Big Compost Bin
This compost bin contains ultracompost (1/30).		examine	object	Big Compost Bin
This compost bin contains ultracompost (2/30).		examine	object	Big Compost Bin
This compost bin contains ultracompost (3/30).		examine	object	Big Compost Bin
This compost bin contains ultracompost (4/30).		examine	object	Big Compost Bin
This compost bin contains ultracompost (5/30).		examine	object	Big Compost Bin
This compost bin contains ultracompost (6/30).		examine	object	Big Compost Bin
This compost bin contains ultracompost (7/30).		examine	object	Big Compost Bin
This compost bin contains ultracompost (8/30).		examine	object	Big Compost Bin
This compost bin contains ultracompost (9/30).		examine	object	Big Compost Bin
This compost bin contains ultracompost (10/30).		examine	object	Big Compost Bin
This compost bin contains ultracompost (11/30).		examine	object	Big Compost Bin
This compost bin contains ultracompost (12/30).		examine	object	Big Compost Bin
This compost bin contains ultracompost (13/30).		examine	object	Big Compost Bin
This compost bin contains ultracompost (14/30).		examine	object	Big Compost Bin
This compost bin contains ultracompost (15/30).		examine	object	Big Compost Bin
This compost bin contains ultracompost (16/30).		examine	object	Big Compost Bin
This compost bin contains ultracompost (17/30).		examine	object	Big Compost Bin
This compost bin contains ultracompost (18/30).		examine	object	Big Compost Bin
This compost bin contains ultracompost (19/30).		examine	object	Big Compost Bin
This compost bin contains ultracompost (20/30).		examine	object	Big Compost Bin
This compost bin contains ultracompost (21/30).		examine	object	Big Compost Bin
This compost bin contains ultracompost (22/30).		examine	object	Big Compost Bin
This compost bin contains ultracompost (23/30).		examine	object	Big Compost Bin
This compost bin contains ultracompost (24/30).		examine	object	Big Compost Bin
This compost bin contains ultracompost (25/30).		examine	object	Big Compost Bin
This compost bin contains ultracompost (26/30).		examine	object	Big Compost Bin
This compost bin contains ultracompost (27/30).		examine	object	Big Compost Bin
This compost bin contains ultracompost (28/30).		examine	object	Big Compost Bin
This compost bin contains ultracompost (29/30).		examine	object	Big Compost Bin
You can grow Anima plants in this Farming patch.		examine	object	Anima patch
An Iasor plant sapling has been planted in this anima patch.		examine	object	Iasor plant
An Iasor plant is growing in this anima patch.		examine	object	Iasor plant
A fully grown Iasor plant		examine	object	Iasor plant
This Iasor plant looks like it is almost out of energy.		examine	object	Withering Iasor plant
This Iasor plant has died.		examine	object	Dead Iasor plant
An Attas plant sapling has been planted in this anima patch.		examine	object	Attas plant
An Attas plant is growing in this anima patch.		examine	object	Attas plant
A fully grown Attas plant		examine	object	Attas plant
This Attas plant looks like it is almost out of energy.		examine	object	Withering Attas plant
This Attas plant has died.		examine	object	Dead Attas plant
A Kronos plant sapling has been planted in this anima patch.		examine	object	Kronos plant
A Kronos plant is growing in this anima patch.		examine	object	Kronos plant
A fully grown Kronos plant		examine	object	Kronos plant
This Kronos plant looks like it is almost out of energy.		examine	object	Withering Kronos plant
This Kronos plant has died.		examine	object	Dead Kronos plant
A dragonfruit plant has been planted in this fruit tree patch.		examine	object	Dragonfruit tree
A dragonfruit plant is growing in this fruit tree patch.		examine	object	Dragonfruit tree
A fully grown dragonfruit plant.		examine	object	Dragonfruit tree
There is a single dragonfruit on this dragonfruit plant.		examine	object	Dragonfruit tree
There are two dragonfruits on this dragonfruit plant.		examine	object	Dragonfruit tree
There are three dragonfruits on this dragonfruit plant.		examine	object	Dragonfruit tree
There are four dragonfruits on this dragonfruit plant.		examine	object	Dragonfruit tree
There are five dragonfruits on this dragonfruit plant.		examine	object	Dragonfruit tree
There are six dragonfruits on this dragonfruit plant.		examine	object	Dragonfruit tree
This dragonfruit plant looks like it could do with pruning with secateurs.		examine	object	Diseased dragonfruit plant
This dragonfruit plant has become diseased and died.		examine	object	Dead dragonfruit plant
This dragonfruit plant has been cut down.		examine	object	Dragonfruit tree stump
You can grow a Redwood tree in this Farming patch.		examine	object	Redwood tree patch
A dead Redwood tree.		examine	object	Dead Redwood tree
A diseased Redwood tree.		examine	object	Diseased Redwood tree
A redwood tree has been planted here.		examine	object	Redwood tree
A Redwood tree has been planted here.		examine	object	Redwood tree
A fully grown Redwood tree.		examine	object	Redwood tree
The greatest dead man himself - Death!		examine	object	Death
It has a sickly sweet odour.		examine	object	Dead tree
Sulphuric lava bubbles inside the vent.		examine	object	Sulphur Vent
A small volcanic eruption modified into a furnace.		examine	object	Volcanic Furnace
The fire burns blue.		examine	object	Torch
A crude torch stuck in the ground that burns with an eerie blue flame.		examine	object	Standing torch
Nothing important to be found here.		examine	object	Empty chest
A barrel of muddy water. Drinking not advised.		examine	object	Barrel of Mud
A barrel of strange spears.		examine	object	Barrel of Spears
The controls resemble a monstrous head. A warning for what lies below.		examine	object	Elevator controls
Going down...		examine	object	Elevator
A pillar carved from rock depicting the visage of the Great Olm.		examine	object	Olmic pillar
An ancient dwelling.		examine	object	Lizard dwelling
A large sacrificial table.		examine	object	Stone table
Dripping water from the swamp above.		examine	object	Drip
Sounds can be heard coming from inside! They will hatch soon!		examine	object	Lizardman eggs
Wonder what's inside?		examine	object	Lizardman eggs
It was a long drop to get in here...		examine	object	Light
Perhaps this leads out of here?		examine	object	Strange hole
Cat.		examine	object	Cat
An ancient stone chest.		examine	object	Stone chest
An ancient stone chest full of hammers.		examine	object	Stone chest
An old vase.		examine	object	Vase
An older vase.		examine	object	Vase
An ancient stone chest. Maybe there's something inside it.		examine	object	Stone chest
It looks like you can pass through it - though it may hurt.		examine	object	Mystical barrier (orange)
It looks like you can pass through it - though it may hurt a fair bit.		examine	object	Mystical barrier (red)
Typically used to fill stuff with water.		examine	object	Water tap
There's something intriguing about a locked chest.		examine	object	Chest
Can be used to walk through walls.		examine	object	Door
Hyacinthoides is a genus of flowering plants in the family Asparagaceae, known as bluebells.		examine	object	Bluebells
Tagetes is a genus of annual or perennial, mostly herbaceous plants in the sunflower family.		examine	object	Marigold
A rose is a woody perennial flowering plant of the genus Rosa.		examine	object	Roses
A beautiful decorative tree.		examine	object	Tree
This tree has been well looked after.		examine	object	Tree
A statue of an old warrior from distant lands.		examine	object	Statue
Home for chickens.		examine	object	Chicken coop
An old bed.		examine	object	Bed
A pool of dangerous chemicals.		examine	object	Chemical pool
Leads to the volcano surface.		examine	object	Cave exit
Reckon I could jump that.		examine	object	Lava gap
Can't help but think how Drakes managed to fit through this...		examine	object	Tunnel
Leads to the upper levels of the volcano.		examine	object	Steps
Leads to a lower level of the volcano.		examine	object	Steps
Conveniently just the right height to climb over!		examine	object	Rocks
Igneous rock is formed when magma cools and solidifies, it may do this above or below the Earth's surface.		examine	object	Rocks
There's a strange smell coming from behind these doors.		examine	object	Alchemical door
Can't imagine what this tastes like...		examine	object	Blue chemical
Watch your step!		examine	object	Chemical vent (red)
An open chest. Maybe there's something in it.		examine	object	Stone chest
A broken tool sits upon the table.		examine	object	Broken machinery
They're a gnome delicacy apparently.		examine	object	King worm
A large display of the Alchemical Hydra in the Mount Karuulm laboratory.		examine	object	Alchemical Hydra display
A bush sculpted into the Alchemical Hydra!		examine	object	Alchemical Topiary
Why would I ever want to go down there?		examine	object	Mysterious pipe
It's pumping out waste.		examine	object	Chemical waste pipe
Welcome to the Sheared Ram Pub.		examine	object	The Sheared Ram
It looks as though only a special key would unlock this chest.		examine	object	Brimstone chest
You unlocked this chest with a special key.		examine	object	Brimstone chest
A pile of bricks dislodged from the wall nearby.		examine	object	Rubble
A small pile of bricks dislodged from the wall nearby.		examine	object	Rubble
There used to be a pile of bricks here, dislodged from the wall nearby.		examine	object	Rubble
Raids II: Theatre of Blood was released on June 7th, 2018.		examine	object	Verzik Vitur display
The quest 'Making Friends with My Arm' was released on September 6th, 2018.		examine	object	Making Friends with My Arm display
Hot pink!		examine	object	Fire
Adventure anywhere! Old School RuneScape Mobile was released globally during Wint- No, that's wrong...Umm, October 30th, 2018.		examine	object	Magic Mirror
The Kebos Lowlands, where Mount Karuulm slayer dungeon is located, were released on January 10th, 2019.		examine	object	Alchemical Hydra display
The Kebos Lowlands, where the Farming Guild is located, were released on January 10th, 2019.		examine	object	Attas plant display
Leather shields were released on February 1st, 2018.		examine	object	Leather shields
Bryophyta was released on April 23rd, 2018.		examine	object	Bryophyta display
An offshoot of the hespori in flower.		examine	object	Blooming Hespori sprout
A shrivelled plant.		examine	object	Shrivelled plant
Looks a bit gnarly.		examine	object	Twisted bush
A closed overgrown dungeon entrance.		examine	object	Dungeon entrance
Must be a way out of this weird, weird place.		examine	object	Keyhole
That'll rot more than just your teeth.		examine	object	Sweets
The wrapper isn't even suitable for recycling. How sad.		examine	object	Sweet
wheeeeee sugar rush hype		examine	object	Sweets
Gosh, that's a big glory.		examine	object	Amulet of Glory
It looks like what you find when solving clues... but there's something odd about it.		examine	object	Strange casket
A mysterious power emanates from this shrine.		examine	object	Altar
The source of all runes.		examine	object	Rune Essence
A part of an old temple.		examine	object	Pillar
Unusual energy is gathered here.		examine	object	Mysterious stone
An old crumbled pillar.		examine	object	Ruined Pillar
Broken parts of an old temple.		examine	object	Rubble
Takes you to places.		examine	object	Handy portal
A secure chest.		examine	object	Larran's big chest
A large display of Sarachnis in the Forthos Dungeon crypt.		examine	object	Sarachnis display
A very ominous fire.		examine	object	Ancient Fire
A altar depicting an eclipsed moon, tainted by the Shaeded Beast.		examine	object	Cursed Altar
An altar depicting a crescent moon.		examine	object	Altar
A door leading further into the temple.		examine	object	Temple Door
A door controlled by a lever on the other side.		examine	object	Door
I wonder what this does?		examine	object	Lever
Filled with forgotten knowledge.		examine	object	Musty bookshelf
A stone relief depicting Ranul and Ralos, the opposing sides of an old religion. There's a slot where something round might fit.		examine	object	Stone Relief
A stone relief depicting Ralos. The stone depicting Ranul has sunk into the ground now the coin has been placed.		examine	object	Stone Relief
A small hole that leads into a different part of the dungeon.		examine	object	Passage
Yep, definitely a wall.		examine	object	Wall
A shrine built to present offerings to Ralos.		examine	object	Sacred Bone Burner
Thick webbing blocking the entrance to the burial crypt.		examine	object	Thick Web
A passage to another realm... I've seen stranger things.		examine	object	Strange passage
A strange vine seems to be growing out of the wall. An ominous presence lurks within.		examine	object	Strange wall
Where does it go?		examine	object	Ladder
It's making sounds inside. It's going to hatch soon!		examine	object	Egg sac
Where'd they go? Eek!		examine	object	Empty sac
Someone smashed it up.		examine	object	Broken sun altar
May contain spiders?		examine	object	Empty Sarcophagus
Under this sign will he conquer.		examine	object	Floor tile
Is that human blood?		examine	object	Blood
A web blocking the path to wherever Sarachnis came from.		examine	object	Web
Outside these markers, fog may kill you.		examine	object	Fog marker
You can grow Crystal trees in this Farming patch.		examine	object	Crystal tree patch
A Crystal tree has been planted in this patch.		examine	object	Crystal tree
Some stairs.		examine	object	Staircase
A ladder.		examine	object	Ladder
Some old sacks.		examine	object	Sacks
It's a chest.		examine	object	Chest
A convenient source of rope.		examine	object	Rope
Tracks in the soil.		examine	object	Tracks
These tall reeds look so pretty by the water.		examine	object	Tall Reeds
The pillar has a rune shaped dent in it.		examine	object	Pillar
A small stone pillar.		examine	object	Pillar
A statue of Baxtorian chiselled in stone.		examine	object	Statue of Baxtorian
A plinth where a statue once stood.		examine	object	Statue Plinth
A bust representing a notable elf.		examine	object	Bust
It's been abandoned here.		examine	object	Pack
I can go up a level.		examine	object	Stairs
I can go down a level.		examine	object	Stairs
I can go up or down a level.		examine	object	Stairs
A small pile of old books.		examine	object	Books
Perfect for reaching the top shelf.		examine	object	Steps
A perfect way to transport books.		examine	object	Book Cart
This tower of books won't move.		examine	object	Books
A whirlwind of knowledge.		examine	object	Books
The seal of the Cadarn clan.		examine	object	Seal of Cadarn
The broken seal of the Cadarn clan.		examine	object	Seal of Cadarn
The seal of the Crwys clan.		examine	object	Seal of Crwys
The broken seal of the Crwys clan.		examine	object	Seal of Crwys
The seal of the Amlodd clan.		examine	object	Seal of Amlodd
The broken seal of the Amlodd clan.		examine	object	Seal of Amlodd
The seal of the Hefin clan.		examine	object	Seal of Hefin
The broken seal of the Hefin clan.		examine	object	Seal of Hefin
The seal of the Iorwerth clan.		examine	object	Seal of Iorwerth
The broken seal of the Iorwerth clan.		examine	object	Seal of Iorwerth
The seal of the Ithell clan.		examine	object	Seal of Ithell
The broken seal of the Ithell clan.		examine	object	Seal of Ithell
The seal of the Meilyr clan.		examine	object	Seal of Meilyr
The broken seal of the Meilyr clan.		examine	object	Seal of Meilyr
The seal of the Trahaearn clan.		examine	object	Seal of Trahaearn
The broken seal of the Trahaearn clan.		examine	object	Seal of Trahaearn
The broken seal of a forgotten clan.		examine	object	Seal of the Forgotten
An old iron grate.		examine	object	Grate
A broken iron grate.		examine	object	Broken Grate
A cabinet full of chemicals.		examine	object	Cabinet
A burnt barrel.		examine	object	Barrel
A burnt fishing net.		examine	object	Fishing net
A burning spiky barricade.		examine	object	Barricade
A recently killed mourner.		examine	object	Mourner
It's starting to heat up!		examine	object	Fire
A member of Ardougne's militia.		examine	object	Knight of Ardougne
One of Gielinor's many citizens.		examine	object	Man
For growing things.		examine	object	Farming patch
A herb seed has been sown in this patch.		examine	object	Herb
There might be something behind it.		examine	object	Blocked Crevice
A stone.		examine	object	Stone
A well placed stone.		examine	object	Stepping stone
A spooky cave.		examine	object	Cave
A cooking range.		examine	object	Cooking range
A symbol of the Ithell clan.		examine	object	Symbol
It was damaged in the battle.		examine	object	Broken Well
I could build a statue here.		examine	object	Statue Space
A statue of the former Lady Ithell.		examine	object	Statue
A broken ranging device.		examine	object	Dwarf multicannon
A hole that has been dug in the ground.		examine	object	Hole
A filled in hole.		examine	object	Hole
The catapult is burnt.		examine	object	Catapult
Light shines through it.		examine	object	Pillar of Light
There's no way through.		examine	object	Blocked Tunnel
The brightest light casts the darkest shadow.		examine	object	Fragment of Seren
In memory of Ysgawyn, hero of the elves.		examine	object	Gravestone
At least they didn't take an arrow to the knee.		examine	object	Dead Elf
I wonder who left this here...		examine	object	Abandoned Equipment
Looks scary in there...		examine	object	Cave
A magical sphere that glimmers within.		examine	object	Orb of light
Something's bubbling away in it.		examine	object	Cauldron
A sturdy watchtower.		examine	object	Watchtower
A burnt sack.		examine	object	Grain sacks
These have grain in them.		examine	object	Grain sacks
Some burnt sacks.		examine	object	Grain sacks
Essyllt's desk.		examine	object	Desk
It's a desk.		examine	object	Desk
A corrupted sceptre with some magical properties.		examine	object	Corrupted Sceptre
Can be used to escape.		examine	object	Teleport Platform
A corrupted crystal bowl of elven design.		examine	object	Singing Bowl
A deposit of corrupted crystal.		examine	object	Corrupt Deposit
An empty deposit.		examine	object	Corrupt Deposit (Depleted)
Some bark covered roots.		examine	object	Corrupt Phren Roots
Some bare roots.		examine	object	Corrupt Phren Roots (Depleted)
There's some fish swimming around here.		examine	object	Corrupt Fishing Spot
There's no more fish here.		examine	object	Corrupt Fishing Spot (Depleted)
A root flourishing with Grym leaves.		examine	object	Corrupt Grym Root
A root that once flourished with Grym leaves.		examine	object	Corrupt Grym Root (Depleted)
A plant rarely found outside of the local lands, if ever.		examine	object	Corrupt Linum Tirinum
A beautiful fibre once grew here.		examine	object	Corrupt Linum Tirinum (Depleted)
Some kind of storage for tools.		examine	object	Tool Storage
A book of recipes for crystal singing.		examine	object	Crystal Singing Recipes
A book about Egniol potions.		examine	object	Egniol Potions
I can cook food on this.		examine	object	Range
A mystical barrier.		examine	object	Barrier
Used by the elves for quick teleportation around Prifddinas.		examine	object	Teleport Platform
A corrupted crystal teleporter that can be used to enter the Gauntlet.		examine	object	The Gauntlet
What's in the chest?		examine	object	Reward Chest
Looks pretty empty to me.		examine	object	Reward Chest
A large wall bearing an illuminated symbol.		examine	object	Illuminated Symbol
A large wall bearing an engraved symbol.		examine	object	Inactive Symbol
I might be able to light this.		examine	object	Node
Details on your Gauntlet performance.		examine	object	Scoreboard
A crystalline sceptre with some magical properties.		examine	object	Crystal Sceptre
A deposit of crystal.		examine	object	Crystal Deposit
A portal to the training ground for the finest warriors in Prifddinas.		examine	object	Gauntlet Portal
A crystal teleporter that can be used to enter the Gauntlet.		examine	object	The Gauntlet
A bunch of rocks. They look like they contain plenty of tephra.		examine	object	Rock Formation (Glowing)
A bunch of rocks.		examine	object	Rock Formation
A bunch of rocks. There doesn't look to be any tephra left in them.		examine	object	Rock Formation (Depleted)
A glowing demonic symbol on the ground.		examine	object	Demonic Symbol
There's a light, fresh breeze flowing from here.		examine	object	Steps
A result of singing minerals from the earth.		examine	object	Crystal outcrop
Takes your items to a nearby high security storage facility.		examine	object	Mine cart
Made for climbing!		examine	object	Ladder
Hopefully the fire isn't lit...		examine	object	Chimney
Watch your step.		examine	object	Roof edge
You can't quite see where this leads to...		examine	object	Dark hole
Ropey.		examine	object	Rope bridge
Hopefully this takes me somewhere useful.		examine	object	Portal
A fancy closed door.		examine	object	Door
A fancy open door.		examine	object	Door
A staircase of crystal, spiralling around a great elven tree.		examine	object	Crystal Staircase
A strange elven device.		examine	object	Memoriam Device
A magical crystal spire sung into dance.		examine	object	Crystal spire
Guess it's a barrel of staves. The big one looks expensive!		examine	object	Staff barrel
There's some fancy looking wands on here.		examine	object	Wand rack
Doesn't have a price tag so you know it must be expensive.		examine	object	Display case
This shop has wares, if you have coin.		examine	object	Shop counter
A scroll showcasing some of the shop's wares.		examine	object	Scroll
Runes for sale.		examine	object	Sign
Shelves with some sort of orb on them.		examine	object	Shelves
I wonder whats in that bowl.		examine	object	Shelves
Full of containers, their labels seem to be in a different language.		examine	object	Shelves
There's something odd about that purple liquid.		examine	object	Shelves
Some rune pouches hanging on hooks.		examine	object	Rune pouches
Maybe I can ring this.		examine	object	Bell
Probably not a good idea to open other peoples chests.		examine	object	Closed chest
Seems like a safe place to make a long term deposit!		examine	object	Chest
This bank booth appears to be closed.		examine	object	Closed bank booth
Used to repair armour.		examine	object	Armour stand
Looks like a book about a throne of some sort.		examine	object	Table
A saw in a table! Genius!		examine	object	Table saw
A banner of the Amlodd clan, a clan of shamans and mystics.		examine	object	Amlodd Banner
A banner of the Cadarn clan, a clan of warriors and hunters.		examine	object	Cadarn Banner
A banner of the Crwys clan, a clan of farmers and botanists.		examine	object	Crwys Banner
A banner of the Hefin clan, a clan of spiritualists and monks.		examine	object	Hefin Banner
A banner of the Iorwerth clan, a clan of slayers and assassins.		examine	object	Iorwerth Banner
A banner of the Ithell clan, a clan of builders and crystal singers.		examine	object	Ithell Banner
A banner of the Meilyr clan, a clan of explorers and herbalists.		examine	object	Meilyr Banner
