english	translation	category	sub_category	source
It looks like it gets pretty narrow further in there.		examine	object	Dark tunnel
Leads into Diango's workshop.		examine	object	Trapdoor
An empty grave.		examine	object	Grave
Not the best place to live.		examine	object	Mausoleum
Warm, but the draughts don't help very much.		examine	object	Fireplace
The clerks and tellers will serve you here.		examine	object	Grand Exchange booth
A picture of it raining - 'Left at my feet rests the soul of my brother. Vengeance will fall for the deeds of another'.		examine	object	Painting
A small set of drawers with an ornamental swan placed on top.		examine	object	Drawers
I believe there's meaning.		examine	object	Staff of Bob the Cat
For mental protection against reality.		examine	object	Armour
Stony!		examine	object	Rocks
It looks like an ordinary fishing spot, just infinitely more sinister...		examine	object	Ominous Fishing Spot
Danger..Mudskippers!		examine	object	Signpost
A fish-filled water tank in the floor.		examine	object	Aquarium
Weedy.		examine	object	Blindweed Patch
Less weedy.		examine	object	Blindweed Patch
Almost clear.		examine	object	Blindweed Patch
Free from weeds.		examine	object	Blindweed Patch
Something is growing here.		examine	object	Blindweed Patch
Fully grown Blindweed.		examine	object	Blindweed Patch
Weedy, wrecked and infertile.		examine	object	Trashed Patch
A stagnant lake.		examine	object	Stagnant Lake
A very large pipe.		examine	object	Chimney Pipe
Rickety.		examine	object	Wooden Stair
It's a palm tree.		examine	object	Palm tree
This controls the entire brewery.		examine	object	Brewing control
A frothing, spinning, possessed control panel.		examine	object	Brewing control
Chugging away nicely.		examine	object	Brewing control
A large brass brewing vat.		examine	object	Brewing vat
The brass seems to be eaten away around the edge...		examine	object	Output Tap
Racks of barrels.		examine	object	Barrels
Round, oaken, barrel-shaped.		examine	object	Brewer's Barrel
Probably where the farming kit is stored.		examine	object	Cupboard
Ah! Definitely where the farming kit is stored.		examine	object	Open Cupboard
Throw the lever! Mwuhahahaha!		examine	object	Pressure Lever
This lever can't be operated right now.		examine	object	Pressure Lever
This is where the brewing ingredients go.		examine	object	Hopper
An ominously stained barrel.		examine	object	Pressure Barrel
This gate is closed.		examine	object	Gate
The blood-chilling flag of the Inebriated.		examine	object	Pirate Sign
'Please remember te wash yer hook'. Sound advice for the hygienic pirate.		examine	object	Sink
An unlit torch.		examine	object	Standing Torch
A lit torch.		examine	object	Standing Torch
A sturdy iron frame, for climbing up and down.		examine	object	Ladder
Eric's been killed by stones falling from the ceiling!		examine	object	Eric
It looks like the magic is failing!		examine	object	Portal
A temporary portal to the demon plane.		examine	object	Magic circle
There are some books here.		examine	object	Shelf
A battle-weathered shield.		examine	object	Shield Display
A display of various relics.		examine	object	Large Display
A collection of rare books.		examine	object	Bookcase
Some sacks here...		examine	object	Sacks
Looks like it's been out of use for some time.		examine	object	Catapult
It's some crates.		examine	object	Crates
It's a crate.		examine	object	Crate
Maybe I can swim across here!		examine	object	River
A rough-looking wooden ladder.		examine	object	Ladder
Looks like this grain has been eaten by rats!		examine	object	Sack
A device for imposing human nature's arrogant will.		examine	object	Rat trap
A device for imposing human-nature's arrogant will.		examine	object	Rat trap
A wooden barrel full of beer.		examine	object	Barrel
A wooden barrel full of stale beer.		examine	object	Barrel
Too dirty to sit on.		examine	object	Stool
Opens the rat door.		examine	object	Rat lever
Contains many rats.		examine	object	Rat barn
Contains rats.		examine	object	Rat barrel
Rat infested.		examine	object	Sack
Full of rat food.		examine	object	Sack
Emits photons of light.		examine	object	Lantern
Ornate metal gates.		examine	object	Gates
Handy piece of garden decor.		examine	object	Trellis top
Big enough for a cat to get in.		examine	object	Hole in wall
How dangerous - someone has left this manhole open.		examine	object	Manhole
I could climb up this.		examine	object	Trellis
I could climb down this.		examine	object	Trellis
A magical device that enables one to walk through walls.		examine	object	Door
A locked door.		examine	object	Door
Observe the rats.		examine	object	Rat wall
A home for rats.		examine	object	Rat hole
They must have forgotten to paint these ones.		examine	object	White roses
How bold?		examine	object	Boulder
A wonderful device that enables one to walk through walls.		examine	object	Door
A wooden barrel, probably for storing things.		examine	object	Barrel
Securely sealed crates that seem to be full of farming equipment.		examine	object	Crates
Someone's been storing assorted tools in here.		examine	object	Tools
I could just go for a choc-ice about now.		examine	object	Choc-Ice Stall
A clay oven for cooking with.		examine	object	Clay Oven
Cheaper than using a chest for storage.		examine	object	Crate
Produced by the Karamja Box Company.		examine	object	Crates
For storing junk in.		examine	object	Cupboard
There are some books and a box here.		examine	object	Cupboard
It's empty.		examine	object	Cupboard
It looks like water once ran here.		examine	object	Water Channel
The water is flowing again.		examine	object	Water Channel
A strange hole carefully made in the ground.		examine	object	Hole
Looks like the Genie's bed.		examine	object	Bed
A pile of rolled up carpets.		examine	object	Rolled up rugs
I'm not going down there without a rope.		examine	object	Crevice
This leads back to the waterfall outside.		examine	object	Cave exit
A wooden door.		examine	object	Door
A bit bluer than I usually like my fires.		examine	object	Fire
I can climb back to the surface.		examine	object	Rope
Nardah's main water supply.		examine	object	Fountain
There's no water here.		examine	object	Fountain
There should be a statue here.		examine	object	Statuette Plinth
The Elidinis Statuette is back in its place.		examine	object	Elidinis Statuette
A sitting stone.		examine	object	Rock Chair
Ali's cart, with his supply of water.		examine	object	Cart
One of Ali's water barrels.		examine	object	Barrel
Metal plating for protection.		examine	object	Armour
Not the most inspired architectural design.		examine	object	Pile of bricks
Some stone temple seating.		examine	object	Stone Pew
Some old looking scrolls sit here.		examine	object	Table
A drab looking bed.		examine	object	Bed
Contains equipment for growing herbs.		examine	object	Shelves
Herb stock is kept here.		examine	object	Shelves
The antique chalice seems to be attached to the wall.		examine	object	Chalice
This old tapestry depicts a bright light shining at a woman's arms.		examine	object	Tapestry
This booth is for private customers only.		examine	object	Bank booth
Lets you put items into your bank.		examine	object	Bank Deposit Box
Mysteriously transports items into your bank.		examine	object	Bank Deposit Chest
Flags flying the Human colours.		examine	object	Human Flag
Flags flying the Dwarf colours.		examine	object	Dwarf Flag
Flags flying the Elf colours.		examine	object	Elf Flag
Flags flying the Gnome colours.		examine	object	Gnome Flag
Flags flying the Werewolf colours.		examine	object	Werewolf Flag
Flags flying the TzHaar colours.		examine	object	TzHaar Flag
A metal portcullis.		examine	object	Portcullis
There's a trapdoor in its base.		examine	object	Champion Statue
There's an open trapdoor in its base.		examine	object	Champion Statue
A handy bank chest.		examine	object	Bank chest
A banner proclaiming your victory over the Earth Warrior Champion!		examine	object	Banner
A banner proclaiming your victory over the Ghoul Champion!		examine	object	Banner
A banner proclaiming your victory over the Giant Champion!		examine	object	Banner
A banner proclaiming your victory over the Goblin Champion!		examine	object	Banner
A banner proclaiming your victory over the Hobgoblin Champion!		examine	object	Banner
A banner proclaiming your victory over the Imp Champion!		examine	object	Banner
A banner proclaiming your victory over the Jogre Champion!		examine	object	Banner
A banner proclaiming your victory over the Lesser Demon Champion!		examine	object	Banner
A banner proclaiming your victory over the Skeleton Champion!		examine	object	Banner
A banner proclaiming your victory over the Zombie Champion!		examine	object	Banner
Closed for business.		examine	object	Closed booth
Emergency exit.		examine	object	Icy Cavern
Enter if you dare...		examine	object	Icy Cavern
Danger - large deadly creatures within!		examine	object	Danger Sign
A strangely decorated chest, the open lock is painted brown.		examine	object	Bronze Chest
A strangely decorated chest, the open lock is painted crimson.		examine	object	Bronze Chest
A strangely decorated chest, the open lock is painted black.		examine	object	Bronze Chest
A strangely decorated chest, the open lock is painted purple.		examine	object	Bronze Chest
A strangely decorated steel chest, open the lock is painted blood red.		examine	object	Steel Chest
A strangely decorated steel chest, the open lock is painted brown.		examine	object	Steel Chest
A strangely decorated steel chest, the open lock is painted crimson.		examine	object	Steel Chest
A strangely decorated steel chest, the open lock is painted black.		examine	object	Steel Chest
A strangely decorated steel chest, the open lock is painted purple.		examine	object	Steel Chest
A strangely decorated black chest, the open lock is painted blood red.		examine	object	Black Chest
A strangely decorated black chest, the open lock is painted brown.		examine	object	Black Chest
A strangely decorated black chest, the open lock is painted crimson.		examine	object	Black Chest
A strangely decorated black chest, the open lock is painted black.		examine	object	Black Chest
A strangely decorated black chest, the open lock is painted purple.		examine	object	Black Chest
A strangely decorated silver chest, the open lock is painted blood red.		examine	object	Silver Chest
A strangely decorated silver chest, the open lock is painted brown.		examine	object	Silver Chest
A strangely decorated silver chest, the open lock is painted crimson.		examine	object	Silver Chest
A strangely decorated silver chest, the open lock is painted black.		examine	object	Silver Chest
A strangely decorated silver chest, the open lock is painted purple.		examine	object	Silver Chest
Used for sharpening blades.		examine	object	Doric's Whetstone
A naked flame seems unwise next to all that swamp gas.		examine	object	Torch
The feeble flame does little to alleviate the chilly dampness.		examine	object	Fire
A bank deposit chest.		examine	object	Chest
A manky old crate.		examine	object	Crate
It looks very small and slippery.		examine	object	Stepping stone
Only sawdust...		examine	object	Crate
Someone's been making marionettes!		examine	object	Crate
A doorway made of light.		examine	object	Doorway
A pile of animal Bones.		examine	object	Bones
Hidden away, I wonder where it goes?		examine	object	Portal
Somewhere to put money.		examine	object	Coin Collector
Somewhere to offer food.		examine	object	Food chute
A statue.		examine	object	Statue
A statue representing water.		examine	object	Statue
A statue representing air.		examine	object	Statue
A place to put your money.		examine	object	Bank
Stairs.		examine	object	Stairs
A lump of rock.		examine	object	Rock
Some small stones.		examine	object	Stones
A rocky ledge.		examine	object	Overhanging rock
Materials for tailors.		examine	object	Tailor's materials
Sandy's desk is piled high with paperwork towers.		examine	object	Sandy's Desk
A large steaming mug of the finest Karamja Coffee.		examine	object	Sandy's Coffee Mug
Looks useful for putting things on.		examine	object	Table
A bin full of paper.		examine	object	Waste Paper Bin
Betty's counter. There is a vial standing on it.		examine	object	Counter
It's very sandy.		examine	object	Sandpit
Can be used to repair certain untradeable gear.		examine	object	Armour stand
These trees are found near water.		examine	object	Willow tree
It's hollow...		examine	object	Hollow tree
A splendid tree.		examine	object	Yew tree
Oh for a marshmallow on a stick!		examine	object	Fireplace
A droopy tree.		examine	object	Willow tree
This transports coal!		examine	object	Coal Truck
This leads to a tunnel too steep for me to scale.		examine	object	Doorway
I can climb this rocky outcrop.		examine	object	Climbing rocks
The doorway leads down into the pyramid.		examine	object	Doorway
I can climb down these.		examine	object	Stairs
A gap.		examine	object	Gap
A narrow ledge.		examine	object	Ledge
A wooden plank.		examine	object	Plank
A stone block.		examine	object	Stone block
You could grow a vine here.		examine	object	Vine patch
Looks sturdy enough to climb!		examine	object	Sand pile
Something heavy must have made this.		examine	object	Hole
The perfect place for a picnic.		examine	object	Flat ground
A large statue made of sandstone.		examine	object	Headless statue
Made of sandstone and granite.		examine	object	Lazim's statue
A large statue.		examine	object	Statue
It has no limbs.		examine	object	Fallen statue
It has a left arm.		examine	object	Fallen statue
It has a right arm.		examine	object	Fallen statue
It has a left leg.		examine	object	Fallen statue
It has a right leg.		examine	object	Fallen statue
It has a left arm and right arm.		examine	object	Fallen statue
It has a left arm and left leg.		examine	object	Fallen statue
It has a left arm and right leg.		examine	object	Fallen statue
It has a right arm and left leg.		examine	object	Fallen statue
It has a right arm and right leg.		examine	object	Fallen statue
It has a left leg and right leg.		examine	object	Fallen statue
It has a left arm, right arm and left leg.		examine	object	Fallen statue
It has a left arm, right arm and right leg.		examine	object	Fallen statue
It has a left arm, left leg and right leg.		examine	object	Fallen statue
It has a right arm, left leg and right leg.		examine	object	Fallen statue
It has all its limbs still attached.		examine	object	Fallen statue
There's a recess on the top shaped like a head.		examine	object	Pedestal
There's a stone head in a recess on the top.		examine	object	Pedestal
The blood globe is lit.		examine	object	Pedestal
The ice globe is lit.		examine	object	Pedestal
The shadow globe is lit.		examine	object	Pedestal
The smoke globe is lit.		examine	object	Pedestal
The blood and ice globes are lit.		examine	object	Pedestal
The blood and shadow globes are lit.		examine	object	Pedestal
The blood and smoke globes are lit.		examine	object	Pedestal
The ice and shadow globes are lit.		examine	object	Pedestal
The ice and smoke globes are lit.		examine	object	Pedestal
The shadow and smoke globes are lit.		examine	object	Pedestal
The ice, shadow and smoke globes are lit.		examine	object	Pedestal
The blood, shadow and smoke globes are lit.		examine	object	Pedestal
The blood, ice and smoke globes are lit.		examine	object	Pedestal
The blood, ice and shadow globes are lit.		examine	object	Pedestal
All the globes - blood, ice, shadow, smoke - are lit.		examine	object	Pedestal
It's made of a magical force.		examine	object	Magic barrier
This fountain is frozen solid.		examine	object	Fountain
It's blocked and is spewing out smoke.		examine	object	Furnace
Something burned in here long ago.		examine	object	Brazier
Something's burning here.		examine	object	Brazier
A finished wall.		examine	object	Wall
A nearly finished wall.		examine	object	Wall
A half finished wall.		examine	object	Wall
It needs much more repair.		examine	object	Wall
A ruined wall.		examine	object	Wall
What's down there?		examine	object	Ladder
There's a recess in it in the shape of a Z.		examine	object	Door
There's a recess in it in the shape of an M.		examine	object	Door
There's a recess in it in the shape of an R.		examine	object	Door
There's a recess in it in the shape of a K.		examine	object	Door
There's a sigil on it shaped like a Z.		examine	object	Pedestal
There's a sigil on it shaped like an M.		examine	object	Pedestal
There's a sigil on it shaped like an R.		examine	object	Pedestal
There's a sigil on it shaped like a K.		examine	object	Pedestal
There's a recess in it in the shape of a left arm.		examine	object	Door
There's a recess in it in the shape of a right arm.		examine	object	Door
There's a recess in it in the shape of a left leg.		examine	object	Door
There's a recess in it in the shape of a right leg.		examine	object	Door
Looks like there was once a building here.		examine	object	Ruins
There's a hole in the roof!		examine	object	Light
A rock with a pickaxe.		examine	object	Rock
He's been trapped in there for a long time.		examine	object	Magic spell
There's a recess in it in the shape of an arm.		examine	object	Door
There's a recess in it in the shape of a leg.		examine	object	Door
A simple stone pedestal.		examine	object	Pedestal
It's small, but it gets bigger.		examine	object	Vine
It's getting a little bigger.		examine	object	Vine
It's getting bigger.		examine	object	Vine
It's getting a lot bigger.		examine	object	Vine
Solid rock from the cave floor.		examine	object	Cave rocks
Limestone floor growth.		examine	object	Stalagmites
The ladder to the Runeversi challenge room for experienced players.		examine	object	Ladder
The ladder back to the Runeversi challenge room.		examine	object	Ladder
The ladder to the Runesquares challenge room for experienced players.		examine	object	Ladder
The ladder back to the Runesquares challenge room.		examine	object	Ladder
A game of runesquares is being played on this table.		examine	object	Table
A game of runeversi is being played on this table.		examine	object	Table
Runesquares challenge room.		examine	object	Plaque
Runeversi challenge room.		examine	object	Plaque
Runesquares challenge room for experienced players.		examine	object	Plaque
Runeversi challenge room for experienced players.		examine	object	Plaque
Looks comfortable...		examine	object	Coffin
Permission to board?		examine	object	Gangplank
Ready...aim...fire!		examine	object	Cannon
Not likely to work with that hole in it.		examine	object	Broken Cannon
Where did the barrel go?		examine	object	Broken Cannon
Ready to fire.		examine	object	Cannon
If I can't destroy this we're sunk.		examine	object	Cannon
Let's hope they don't repair it.		examine	object	Broken Cannon
Useful for transportation of valuable items.		examine	object	Crate
For the storage of plunder.		examine	object	Plunder Storage
Warning! Contents may explode!		examine	object	Powder Barrel
I wouldn't be surprised if bits land over in Lumbridge.		examine	object	Barrel
Rigged to blow.		examine	object	Barrel
I can climb down here.		examine	object	Climbing Net
Full of gunpowder. I'd best be careful.		examine	object	Powder Barrel
Stores repair items.		examine	object	Repair Locker
Cannons. Lots of cannons.		examine	object	Gun Locker
The only way to get up the mast.		examine	object	Climbing net
For swinging on.		examine	object	Rope
This isn't currently usable.		examine	object	Cannon
This is rigged to blow!		examine	object	Barrel
You can light this.		examine	object	Fuse
That water can't be good.		examine	object	Ship hull
That's plugged it.		examine	object	Ship hull
For storing plunder.		examine	object	Chest
This seems to stand out.		examine	object	Ancient Pillar
A security gate.		examine	object	Gate
Shake that booty!		examine	object	Open chest
An old storage chest.		examine	object	Closed chest
Stores items for the journey.		examine	object	Repair Locker
Who knows where it may lead?		examine	object	Interdimensional rift
A gateway back to Gielinor.		examine	object	Portal Home
The Professor's been at it again!		examine	object	Portal machine
A pile of lime rock.		examine	object	Limestone rock
A pile of rock formerly containing lime.		examine	object	Pile of rock
This wall is densely packed with crystals.		examine	object	Amethyst crystals
There's nothing here.		examine	object	Empty wall
All that has been, all that is and space for all that will be.		examine	object	Our lives
Looks like a tight squeeze.		examine	object	Cave entrance
Perhaps you might like to go in this direction.		examine	object	Sign
Perhaps you can get a grip here and climb the wall.		examine	object	Rough wall
This would be easier if the rope were under more tension!		examine	object	Tightrope
It's a sewer pipe with some rope tied to it.		examine	object	pipe with rope
A bit of rope.		examine	object	Rope
A section of rope.		examine	object	straight rope
You can climb down here.		examine	object	Dug hole
Hard to notice, but this mud looks disturbed.		examine	object	Mud patch
It's a grill.		examine	object	Grill
How's your balance?		examine	object	Narrow wall
This door is locked.		examine	object	Door
The door is slightly ajar.		examine	object	Door
A lever pointing upwards.		examine	object	Lever A
A lever pointing downwards.		examine	object	Lever A
Handy that they're already lit.		examine	object	Lantern
Disturbingly, its eyes look everywhere in the room except at you.		examine	object	Spooky picture
The door is not closed.		examine	object	Door
Little candles flickering.		examine	object	Candles
Looks a bit shabby...		examine	object	Grandfather clock
An enigmatic cabbage.		examine	object	Cabbage
Not your average garden feature...		examine	object	Gallows
Did that chair just move?		examine	object	Chair
Dare I go up?		examine	object	Staircase
These stairs look spooky!		examine	object	Staircase
A filthy but sturdy looking table.		examine	object	Table
I'm not eating off that.		examine	object	Table
It's a strange machine.		examine	object	Strange machine
It's a table for putting objects on.		examine	object	Table
Convenient for storage.		examine	object	Crates
A simple torch stuck in the ground.		examine	object	Standing torch
A barbarian flag.		examine	object	Standard
It would keep the wind out better if it were closed.		examine	object	Door
The entrance to the barbarians' longhall.		examine	object	Longhall door
It's getting substantially bigger.		examine	object	Vine
Time for a big leap.		examine	object	Wall
Try not to belly-flop.		examine	object	Gap
A handy way down.		examine	object	Crate
Looks like whoever uses this has claws on their hands.		examine	object	Ladder
A hurdle.		examine	object	Hurdle
A very slippery stepping stone.		examine	object	Stepping stone
A scary zip line for teeth?		examine	object	Zip line
A goal.		examine	object	Goal
This leads to the practice tower.		examine	object	Tower ladder
This leads back down to the guild.		examine	object	Tower ladder
I wonder if I can hit a bullseye?		examine	object	Target
The door to the Ranging Guild.		examine	object	Guild door
Goes up and down!		examine	object	ladder
A wooden barrel.		examine	object	Barrel
An empty ale barrel.		examine	object	Barrel
A barrel of bad ale.		examine	object	Barrel
A barrel of unfermented liquid.		examine	object	Barrel
A barrel of bad cider.		examine	object	Barrel
A barrel of Dwarven Stout.		examine	object	Dwarven Stout
A barrel of mature Dwarven Stout.		examine	object	Mature Dwarven Stout
A barrel of Asgarnian Ale.		examine	object	Asgarnian Ale
A barrel of mature Asgarnian Ale.		examine	object	Mature Asgarnian Ale
A barrel of Greenmans Ale.		examine	object	Greenmans Ale
A barrel of mature Greenmans Ale.		examine	object	Mature Greenmans Ale
A barrel of Wizards Mind Bomb.		examine	object	Wizards Mind Bomb
A barrel of mature Wizards Mind Bomb.		examine	object	Mature Wizards Mind Bomb
A barrel of Dragon Bitter.		examine	object	Dragon Bitter
A barrel of mature Dragon Bitter.		examine	object	Mature Dragon Bitter
A barrel of Moonlight Mead.		examine	object	Moonlight Mead
A barrel of mature Moonlight Mead.		examine	object	Mature Moonlight Mead
A barrel of Axeman's Folly.		examine	object	Axeman's Folly
A barrel of mature Axeman's Folly.		examine	object	Mature Axeman's Folly
A barrel of Chef's Delight.		examine	object	Chef's Delight
A barrel of mature Chef's Delight.		examine	object	Mature Chef's Delight
A barrel of Slayer's Respite.		examine	object	Slayer's Respite
A barrel of mature Slayer's Respite.		examine	object	Mature Slayer's Respite
A barrel of Cider.		examine	object	Cider
A barrel of mature Cider.		examine	object	Mature Cider
Turns milk into other dairy products.		examine	object	Dairy churn
This stall smells great.		examine	object	Pie stall
A teleportation scroll that seems to be fixed to the ground of Zulrah's shrine.		examine	object	Zul-Andra teleport
For observing what's going on further into the swamp.		examine	object	Telescope
A secure door.		examine	object	Door
A metal gate bars your way.		examine	object	Gate
Fine silk woven by experts.		examine	object	Silk stall
Precious stones from around the world.		examine	object	Gem stall
All manner of animal clothing.		examine	object	Fur stall
Spices to tingle your taste buds.		examine	object	Spice stall
Fine silver items are for sale here.		examine	object	Silver stall
It's getting pretty darn big.		examine	object	Vine
This is about as big as it gets.		examine	object	Vine
Your vine bears much fruit.		examine	object	Grape vine
Your vine bears fruit.		examine	object	Grape vine
Your vine bears some fruit.		examine	object	Grape vine
Your vine bears a little fruit.		examine	object	Grape vine
Your vine is nearly out of juice.		examine	object	Grape vine
It lived a fruitful life.		examine	object	Dead vine
Don't eat any!		examine	object	Fairy ring
Presumably that's what one calls a scarecrow in coastal regions.		examine	object	Scaregull
A gate.		examine	object	Gate
It looks small and slippery.		examine	object	Stepping stone
The door is boarded up.		examine	object	Door
Staff only beyond this point!		examine	object	Door
Allows access to level above.		examine	object	Ladder
